{
  "version": "ai-reviewer-verdict.v1",
  "risk_id": "risk-20260601-workbench-server-route-boundary",
  "reviewer_id": "claude-deepseek-gate-repair-readonly",
  "model": "deepseek-v4-pro shards with deepseek-v4-flash synthesis",
  "reviewed_at": "2026-06-02T01:12:10.000Z",
  "verdict": "pass",
  "blocking_findings": [],
  "non_blocking_findings": [
    "The backend_extraction_empty error message still names the historical server file instead of all backend route source files; this is cosmetic and does not affect gate accuracy.",
    "The array-source extractor path is covered by the real multi-source API contract test shape rather than a separate synthetic unit test."
  ],
  "evidence_refs": [
    "src/workflow/api-route-contract.js",
    "tools/check-api-route-contract.mjs",
    "test/api-route-contract.test.js",
    "test/governance-enrollment.test.js",
    "node tools/run-with-node18.mjs --test test/api-route-contract.test.js test/governance-enrollment.test.js",
    "node tools/run-with-node18.mjs tools/check-api-route-contract.mjs"
  ],
  "scope": {
    "files": [
      "src/workflow/api-route-contract.js",
      "tools/check-api-route-contract.mjs",
      "test/api-route-contract.test.js",
      "test/governance-enrollment.test.js"
    ],
    "diff_summary": "Expand API route contract extraction to read both the Workbench server entrypoint and the newly extracted agent key route module, then align the large-file governance enrollment date with the updated manifest.",
    "gates_reviewed": [
      "node tools/run-with-node18.mjs --test test/api-route-contract.test.js test/governance-enrollment.test.js",
      "node tools/run-with-node18.mjs tools/check-api-route-contract.mjs"
    ]
  },
  "notes": "DeepSeek found this to be extractor coverage expansion rather than a gate relaxation, with no blocking closeout issues."
}
