{
  "version": "ai-reviewer-verdict.v1",
  "risk_id": "risk-20260601-workbench-server-route-boundary",
  "reviewer_id": "claude-deepseek-closeout-readonly",
  "model": "deepseek-v4-pro",
  "reviewed_at": "2026-06-02T01:06:25.000Z",
  "verdict": "pass",
  "blocking_findings": [],
  "non_blocking_findings": [
    "resolution.fixed_by_commit used a short 7-character hash in the reviewed closeout record; the ledger was updated afterward to use the full 40-character commit hash.",
    "The sharded reviewer artifact explains that shard-level inconclusive notes were resolved by synthesis PASS, which is acceptable for this bounded closeout.",
    "release.required is recorded as false for an internal route-boundary refactor; future schema tests could cover release metadata."
  ],
  "evidence_refs": [
    "docs/governance/known-risk-ledger.json",
    "test/known-risk-ledger.test.js",
    "docs/examples/reviewer-risk-20260601-workbench-server-route-boundary-deepseek.json",
    "node tools/run-with-node18.mjs --test test/workbench-server.test.js test/known-risk-ledger.test.js",
    "npm run check:known-risk-closeout",
    "npm run check:known-risk-closeout:required"
  ],
  "scope": {
    "files": [
      "docs/governance/known-risk-ledger.json",
      "test/known-risk-ledger.test.js",
      "docs/examples/reviewer-risk-20260601-workbench-server-route-boundary-deepseek.json"
    ],
    "diff_summary": "Review the fixed ledger closeout record, synchronized known-risk ledger test counts, and DeepSeek implementation-review artifact for the Workbench server route-boundary risk.",
    "gates_reviewed": [
      "node tools/run-with-node18.mjs --test test/workbench-server.test.js test/known-risk-ledger.test.js",
      "npm run check:known-risk-closeout",
      "npm run check:known-risk-closeout:required expected to fail only on remaining open risks"
    ]
  },
  "notes": "DeepSeek closeout review passed with no blocking findings. The short-hash recommendation was applied before final ledger commit."
}
