{
  "version": "ai-reviewer-verdict.v1",
  "risk_id": "risk-20260602-headless-worker-planning-split",
  "reviewer_id": "deepseek-lfg-p5-headless-worker-planning-review",
  "model": "deepseek-v4-pro sharded review with deepseek-v4-flash synthesis",
  "reviewed_at": "2026-06-02T22:03:00+08:00",
  "verdict": "pass",
  "blocking_findings": [],
  "non_blocking_findings": [],
  "evidence_refs": [
    "node tools/run-with-node18.mjs --test test/headless-worker-planning.test.js test/headless-cli-orchestrator.test.js test/governance-enrollment.test.js",
    "npm run check:large-files",
    "src/workflow/headless-cli-orchestrator.js",
    "src/workflow/headless-worker-planning.js",
    "test/headless-worker-planning.test.js",
    "test/headless-cli-orchestrator.test.js",
    ".largefile-manifest.json",
    "docs/governance/LARGE_FILE_GOVERNANCE_PLAN.md"
  ],
  "scope": {
    "files": [
      "src/workflow/headless-cli-orchestrator.js",
      "src/workflow/headless-worker-planning.js",
      "test/headless-worker-planning.test.js",
      "test/headless-cli-orchestrator.test.js",
      ".largefile-manifest.json",
      "docs/governance/LARGE_FILE_GOVERNANCE_PLAN.md"
    ],
    "diff_summary": "Headless CLI worker planning was extracted from src/workflow/headless-cli-orchestrator.js into a 75-line src/workflow/headless-worker-planning.js module. The orchestrator decreased from 2090 to 2042 lines while preserving selected work-package filtering, child worker id/pool id defaults, and WorkerSpawned/WorkerHeartbeat fact construction.",
    "gates_reviewed": [
      "node tools/run-with-node18.mjs --test test/headless-worker-planning.test.js test/headless-cli-orchestrator.test.js test/governance-enrollment.test.js",
      "npm run check:large-files"
    ]
  },
  "notes": "DeepSeek source, test, and metadata shards all returned PASS. The review confirmed behavior-preserving extraction of selected work packages and lifecycle spawn facts, no weakening of child acceptance, owned-file validation, host-boundary checks, completion authority, continuation, or snapshot behavior, and honest metadata that keeps LFG-P5 in_progress with P5.2/P5.3/P5.4 pending."
}
